{
  "source": null,
  "name": "اَلنَّفْسُ تَبْكِي عَلَى الدُّنْيَا",
  "latin": "Annafsu Tabkî 'Alâd-Dunyâ",
  "text": {
    "1": {
      "arabic": "اَلنَّفْسُ تَبْكِي عَلَى الدُّنْيَا وَقَدْ عَلِمَتْ ۞ أَنَّ السَّلَامَةَ فِيْهَا تَرْكُ مَا فِيْهَا",
      "latin": "Annafsu tabkî 'alâd-dunyâ wa qod 'alimat ۞ Annas-salâmata fîhâ tarku mâ fîhâ"
    },
    "2": {
      "arabic": "لَا دَارَ لِلْمَرْءِ بَعْدَ الْمَوْتِ يَسْكُنُهَا ۞ إِلَّا الَّتِي كَانَ قَبْلَ الْمَوْتِ بَانِيْهَا",
      "latin": "Lâ dârun lil mar-i ba'dal mauti yaskunuhâ ۞ Illâl-latî kâna qoblal mauti bânîhâ"
    },
    "3": {
      "arabic": "فَإِنْ بَنَاهَا بِخَيْرٍ طَابَ مَسْكَنُهَا ۞ وَإِنْ بَنَاهَا بِشَرٍّ خَابَ بَانِيْهَا",
      "latin": "Fa-in banâhâ bikhoirin thôba maskanuhâ ۞ Wa in banâhâ bisyarrin khôbâ bânîhâ"
    },
    "4": {
      "arabic": "أَيْنَ الْمُلُوْكُ الَّتِي كَانَتْ مُسَلْطَنَةً ۞ حَتَّى سَقَاهَا بِكَأْسِ الْمَوْتِ سَاقِيْهَا",
      "latin": "Ainal mulûkul-latî kânat musalthonatan ۞ Hattâ saqôhâ bika,sil mauti sâqîhâ"
    },
    "5": {
      "arabic": "أَمْوَالُنَا لِذَوِي الْمِيْرَاثِ نَجْمَعُهَا ۞ وَدُوْرُنَا لِخَرَابِ الدَّهْرِ نَبْنِيْهَا",
      "latin": "Amwâlunâ lidzawîl mîrôtsi najma'uhâ ۞ Wa dûrunâ likhorôbid-dahri nabnîhâ"
    },
    "6": {
      "arabic": "كَمْ مِنْ مَدَائِنَ فِي الْآفَاقِ قَدْ بُنِيَتْ ۞ أَمْسَتْ خَرَابًا وَذَانُ الْمَوْتِ دَانِيْهَا",
      "latin": "Kam min madâ-ini fîl afâqi qod buniyat ۞ Amsat khorôban wadzânul mauti dânîhâ"
    },
    "7": {
      "arabic": "لِكُلِّ نَفْسٍ وَإِنْ كَانَتْ عَلَى وَجَلٍ ۞ مِنَ الْمَنِيَّةِ آمَالٌ تُقَوِّيْهَا",
      "latin": "Likulli nafsin wa in kânat 'alâ wajlin ۞ Minal maniyyati ãmâlun tuqowwîhâ"
    },
    "8": {
      "arabic": "فَالْمَرْءُ يَبْسُطُهَا وَالدَّهْرُ يَقْبِضُهَا ۞ وَالنَّفْسُ تَنْشُرُهَا وَالْمَوْتُ يَطْوِيْهَا",
      "latin": "Fal mar-u yabsithuhâ waddahru yaqbidluhâ ۞ Wannafsu tansyuruhâ wal mautu yathwîhâ"
    }
  },
  "translations": {
    "id": {
      "name": "Jiwa Menangis Karena Dunia",
      "text": {
        "1": "Jiwaku menangis karena dunia, padahal ia telah mengetahui ۞ bahwa keselamatan adalah dengan meninggalkan apa yang ada di dalamnya",
        "2": "Tidak ada rumah bagi seseorang setelah kematian yang ia tinggali, ۞ Kecuali rumah yang telah ia bangun sebelum kematian",
        "3": "Jika ia membangunnya dengan kebaikan, maka baiklah tempat tinggalnya, ۞ tetapi jika ia membangunnya dengan keburukan, maka buruklah bangunannya",
        "4": "Di mana raja-raja yang dulu berkuasa, ۞ Hingga diberikan kepadanya minuman dengan cangkir kematian",
        "5": "Harta kita kumpulkan untuk ahli waris ۞ dan rumah yang kita bangun akan hancur seiring berjalannya waktu",
        "6": "Betapa banyak kota-kota yang telah dibangun di penjuru dunia, ۞ Kini menjadi reruntuhan, karena maut telah mendekatinya",
        "7": "Setiap jiwa, meskipun dalam kekhawatiran terhadap kematian, ۞ memiliki harapan yang memperkuatnya",
        "8": "Manusia yang membentangkannya, namun waktu yang menariknya, ۞ Jiwa yang menyebarkannya, namun maut yang melipatnya"
      }
    }
  },
  "last_updated": "2025-11-22"
}
