{
  "source": "kitabkuning.id",
  "author": "Sheikh Abu Bakar bin Salim",
  "transmitter": null,
  "name": "شَفِيْعُ الْخَلْقِ فِي يَوْمِ الْقِيَامَةِ",
  "latin": "Sholatullah Ala Tohal Yamani",
  "text": {
    "1": {
      "arabic": "صَلَاةُ الله عَلَى طٰهَ الْيَمَانِي ۞ شَفِيْعِ الْخَلْقَ فِي يَوْمِ الْقِيَامَةِ",
      "latin": "Shalatullahi 'ala Thahal-Yamani ۞ Syafi'il khalqa fi yaumil qiyāmah"
    },
    "2": {
      "arabic": "دَعُونِي فَالَّذِي أَهْوَى دَعَانِي ۞ وَأَبْدَانِي مِنَ الْبُشْرَى عَلَامَهْ",
      "latin": "Da'uni falladzi ahwā da'ānī ۞ Wa abdani minal-busyra 'alamah"
    },
    "3": {
      "arabic": "وَاظْهَرْلىِ غَسِيْضَاتِ الْمَعَانِي ۞ يَقِيْنًا عِنْدَ مَا كَشَفَ اللِّثَامَهْ",
      "latin": "Wa azhar li ghasidhatil ma'ani ۞ Yaqiinan 'inda ma kasyafallitsamah"
    },
    "4": {
      "arabic": "سَقَانِي الْكَاسْ أُفِدِى مَنْ سَقَانِي ۞ أَلَا لِلّٰهْ مِنْ تِلْكَ الْمُدَامَهْ",
      "latin": "Saqanil-kaas ufidi man saqani ۞ Ala lillahi min tilkal-mudamah"
    },
    "5": {
      "arabic": "وَفَكّ الْقَيدْ مِنْ بَعْدِ امْتِحَانِ ۞ وَأَتْحَفَنِي بِأَنْوَاعِ الْكَرَامَهْ",
      "latin": "Wa fakkal-qaid min ba'dimtihaani ۞ Wa atahafani bi anwa'il-karamah"
    },
    "6": {
      "arabic": "وَأَوْضَحْ فِي الْهَوَى قَصْدِي وَشَانِي ۞ عَلَى وَرَع وَجَنَّبَنِي الْمَلامَهْ",
      "latin": "Wa auwashah fil-hawa qashdi wa syaani ۞ 'Ala wara'a wa jannabanil-malamah"
    },
    "7": {
      "arabic": "مَضَى فِي الْعِلِمْ وَالتَّقْوَى زَمَانِي ۞ وَفِي الْأُخْرَى إِلَى دَارِ الْمُقَامَهْ",
      "latin": "Madha fil-'ilim wat-taqwa zamani ۞ Wa fil-ukhraa ila daril-muqamah"
    },
    "8": {
      "arabic": "وَحَادِى الرَّكْبَ لَمَّا أَنحَدَانِي ۞ إِلَى سَفْحِ النَّقَا مَا بَيْنَ رَامَهْ",
      "latin": "Wa hadir-rakba lamma anhadani ۞ Ila safhin-naqa ma baina Ramah"
    }
  },
  "translations": {
    "id": {
      "name": "Sholawat Da'uni",
      "translator": "Unknown",
      "text": {
        "1": "Semoga sholawat Allah tercurah untuk Thoha al-Yamaniy ۞ pemberi syafa'at makhluk pada hari Kiyamat.",
        "2": "Biarkan aku mencintainya, karena orang yang kucintai pernah memanggilku. ۞ Dan telah menampakkan tanda khusus sebagai kabar gembira bagiku",
        "3": "Dia telah mengajarkan kepadaku makna- makna yang rumit. ۞ Sebagai ilmu yakin ketika seluruh hijab terbuka.",
        "4": "Kutebus diri ini demi seseorang yang memberi minuman kepadaku ۞ Hanya dari Allah kami mendapat minuman with cita rasa yang tinggi.",
        "5": "Lepas sudah seluruh ikatan setelah melalui seluruh ujian yang berat. ۞ Dia pula yang memberikan macam-macam karomah (kemuliaan).",
        "6": "Dia pula yang menjelaskan tujuan dan usahaku dalam bentuk cinta. ۞ Di atas sifat wara' (hati-hati) dan menjauhkanku dari sifat tercela.",
        "7": "Zaman telah kulalui dengan ilmu dan ketaqwaan. ۞ Serta ilmu-ilmu lain sampai datang hari Kiyamat",
        "8": "Dialah pemimpin kelompok ketika menuntunku ۞ Menuju Ke kaki bukit di antara Ramah."
      }
    },
    "en": {
      "name": "Blessings upon Taha the Yemeni",
      "translator": "AI Assistant",
      "text": {
        "1": "May the peace of Allah be upon Taha the Yemeni ۞ The intercessor for creation on the Day of Resurrection.",
        "2": "Leave me be, for the one I love has called me. ۞ And has shown me a sign of glad tidings.",
        "3": "He has revealed to me the hidden meanings. ۞ With certainty, when the veil was lifted.",
        "4": "He gave me the cup to drink; I would sacrifice myself for the one who gave me drink. ۞ Indeed, from Allah comes that pure drink.",
        "5": "The shackles were released after a time of trial. ۞ And he gifted me with various kinds of noble miracles.",
        "6": "He clarified my purpose and my state in love. ۞ Upon piety, and he kept me away from blame.",
        "7": "My time has passed in knowledge and God-consciousness. ۞ And in the hereafter, towards the Eternal Abode.",
        "8": "The caravan leader, when he guided me, ۞ To the foot of the hill between Ramah."
      }
    }
  },
  "last_updated": "2026-04-11"
}