{
  "source": "Duta Islam",
  "author": null,
  "transmitter": "Gus Elham (Ahbaabul Musthofa)",
  "name": "أَدِمِ الصَّلَاةَ عَلَى الْحَبِيبِ",
  "latin": "Adimishsholata 'Alal Habib",
  "text": {
    "1": {
      "arabic": "أَدِمِ الصَّلَاةَ عَلَى الْحَبِيبِ ۝ فَصَلَاتُهُ نُورٌ وَطِيبُ",
      "latin": "Adimish-sholata 'alal habib, fasholatuhu nurun wathib"
    },
    "2": {
      "arabic": "أَنْفَاسُ جَنَّاتٍ مَفَاتِحُ ۝ رَحْمَةٍ نَغَمٌ حَبِيبُ",
      "latin": "Anfasu jannatin mafatihu, rohmatin naghomun habib"
    },
    "3": {
      "arabic": "تَسْرِي فَتَبْعَثُ بِالنَّدَى ۝ وَالرَّيِّ لِلرُّوحِ الْجَدِيبِ",
      "latin": "Tasri fatab'atsu binnada, warroyyi lirruhil jadib"
    },
    "4": {
      "arabic": "وَتَطُوفُ بِالرِّضْوَانِ ۝ تَنْثُرُهُ عَلَى كُلِّ الْقُلُوبِ",
      "latin": "Wa tathufu birridlwan, tantsuruhu 'ala kullil qulub"
    },
    "5": {
      "arabic": "أُدْعُ الْإِلٰهَ كَمَا تَشَاءُ ۝ بِهَا تَجِدْهُ يَسْتَجِيبُ",
      "latin": "Ud'ul ilaha kama tasya-u, biha tajid-hu yastajib"
    },
    "6": {
      "arabic": "وَاطْلُبْ بِهَا مَا تَرْتَجِي ۝ مِنْهُ تَنَلْ أَوْفَى نَصِيبُ",
      "latin": "Wathlub biha ma tartaji, minhu tanal aufa nashib"
    },
    "7": {
      "arabic": "اللهُ صَلَّى وَالْمَلَائِكَةُ ۝ الْكِرَامُ عَلَى الْحَبِيبِ",
      "latin": "Allahu sholla wal mala-ikatu, al-kiromu 'alal habib"
    },
    "8": {
      "arabic": "وَنَالَ مَنْ صَلَّى عَلَيْهِ ۝ الْخَيْرَ وَالْمَدَدَ الرَّخِيبَ",
      "latin": "Wa nala man sholla 'alaih, al-khoiro wal madadar-rokhib"
    },
    "9": {
      "arabic": "إِنَّ الصَّلَاةَ عَلَى رَسُولِ اللهِ ۝ شَمْسٌ لَا تَغِيبُ",
      "latin": "Innash-sholata 'ala rosulillah, syamsun la taghib"
    },
    "10": {
      "arabic": "حَاشَا يُضَامُ مَنِ اسْتَجَارَ ۝ بِهَا وَحَاشَا أَنْ يَخِيبَ",
      "latin": "Hasya yudlamu man-istajaro, biha wa hasya an yakhib"
    },
    "11": {
      "arabic": "فَإِذَا دَعَوْتَ اللهَ فِي ۝ أَمْرٍ عَظِيمٍ أَوْ عَصِيبٍ",
      "latin": "Fa idza da'autallaha fi, amrin 'adhimin aw 'ashib"
    },
    "12": {
      "arabic": "فَابْدَأْ دُعَاءَكَ وَاخْتَتِمْهُ ۝ بِالصَّلَاةِ عَلَى الْحَبِيبِ",
      "latin": "Fabda' du'a-aka wakhtatimhu, bishsholati 'alal habib"
    }
  },
  "translations": {
    "id": {
      "name": "Adimishsholata 'Alal Habib (Dawamkan Sholawat)",
      "translator": "Gemini AI",
      "text": {
        "1": "Dawamkanlah (kekalkanlah) sholawat kepada kekasih Nabi Muhammad, karena sholawat kepadanya adalah cahaya dan keharuman.",
        "2": "Bagaikan hembusan nafas surga dan kunci-kunci, rahmat serta nada yang dicintai.",
        "3": "Ia mengalir membawa kesejukan embun, dan mengairi ruh yang sedang gersang.",
        "4": "Ia berkeliling dengan membawa keridhaan, menyebarkannya ke dalam setiap hati.",
        "5": "Berdoalah kepada Tuhan sesukamu, dengan wasilah sholawat itu niscaya kau dapati Dia mengabulkanmu.",
        "6": "Mintalah apa yang engkau harapkan dengannya, dari-Nya engkau akan mendapat bagian yang paling sempurna.",
        "7": "Allah bersholawat begitu pula para Malaikat, yang mulia kepada sang kekasih.",
        "8": "Dan akan memperoleh bagi siapa yang bersholawat kepadanya, kebaikan dan pertolongan yang luas.",
        "9": "Sesungguhnya sholawat kepada Rasulullah itu, laksana matahari yang tak pernah terbenam.",
        "10": "Mustahil akan dizalimi orang yang berlindung, dengannya (sholawat) dan mustahil ia akan kecewa.",
        "11": "Maka apabila engkau berdoa kepada Allah dalam, urusan yang besar atau sulit.",
        "12": "Maka mulailah doamu dan akhirilah ia, dengan sholawat kepada sang kekasih."
      }
    },
    "en": {
      "name": "Keep Sending Blessings Upon the Beloved",
      "translator": "Gemini AI",
      "text": {
        "1": "Keep sending blessings upon the Beloved, for blessings upon him are light and fragrance.",
        "2": "Like the breaths of Paradise and the keys, of mercy and a beloved melody.",
        "3": "It flows bringing the freshness of dew, and irrigation for the barren soul.",
        "4": "It circulates with divine pleasure, spreading it upon all hearts.",
        "5": "Call upon God as you wish, through it (blessings) you will find Him responding.",
        "6": "And ask through it what you hope for, from Him you shall receive the most ample share.",
        "7": "Allah sends blessings and so do the Angels, the noble ones upon the Beloved.",
        "8": "And whoever sends blessings upon him shall attain, goodness and expansive support.",
        "9": "Verily, the blessing upon the Messenger of Allah is, a sun that never sets.",
        "10": "Far be it that one who seeks refuge through it is wronged, and far be it that they should ever fail.",
        "11": "So when you call upon Allah regarding, a great or difficult matter.",
        "12": "Then begin your prayer and conclude it, with blessings upon the Beloved."
      }
    }
  },
  "last_updated": "2026-03-27"
}
